{
  "analysis": {
    "internal_comparison": {
      "candidate": "gpt-oss-rs-auto",
      "comparator": "gpt-oss-rs-scalar",
      "decode_throughput": {
        "95ci": [
          5.587304150001382,
          6.229977178165235
        ],
        "estimate": 6.054754089097236,
        "iterations": 10000,
        "reported_speedup": 6.054754089097236,
        "supported": true
      },
      "full_request_latency": {
        "95ci": [
          0.9323130624233724,
          0.9459377921976782
        ],
        "estimate": 0.9358224095157384,
        "iterations": 10000,
        "reported_speedup": null,
        "supported": false
      },
      "prompt_latency": {
        "95ci": [
          0.8316324422526801,
          0.8503485973435659
        ],
        "estimate": 0.8349691620655352,
        "iterations": 10000,
        "reported_speedup": null,
        "supported": false
      }
    },
    "llama_context_policy": "same-host context only; no universal or cross-project speedup claim",
    "ratio_policy": "only paired internal gpt-oss-rs Auto-versus-scalar speedups with 95% CI above 1 are reportable",
    "summaries": {
      "gpt-oss-rs-auto": {
        "median_decode_tokens_per_second": 1.8799463540442085,
        "median_full_request_seconds": 224.473497202,
        "median_peak_rss_kib": 10659476,
        "median_prompt_seconds": 220.205564765,
        "median_startup_seconds": 59.378842992,
        "median_ttft_seconds": 220.205798688,
        "samples": 5
      },
      "gpt-oss-rs-scalar": {
        "median_decode_tokens_per_second": 0.3104909508099459,
        "median_full_request_seconds": 210.067329024,
        "median_peak_rss_kib": 10659520,
        "median_prompt_seconds": 183.864855894,
        "median_startup_seconds": 59.190507156,
        "median_ttft_seconds": 183.865082757,
        "samples": 5
      },
      "llama.cpp-normal": {
        "median_decode_tokens_per_second": 15.42927125623198,
        "median_full_request_seconds": 1.8971079739967536,
        "median_peak_rss_kib": 23509208,
        "median_prompt_seconds": 1.374574,
        "median_startup_seconds": 6.039517312998214,
        "median_ttft_seconds": 1.374574,
        "samples": 5
      },
      "llama.cpp-ubatch-1": {
        "median_decode_tokens_per_second": 15.646391550948563,
        "median_full_request_seconds": 3.998079542998312,
        "median_peak_rss_kib": 23509112,
        "median_prompt_seconds": 3.485627,
        "median_startup_seconds": 6.03895594399728,
        "median_ttft_seconds": 3.485627,
        "samples": 5
      }
    },
    "token_divergence": false,
    "token_identity": {
      "gpt-oss-rs-auto": {
        "matches_official": true,
        "sequences": [
          [
            200005,
            35644,
            200008,
            976,
            1825,
            5003,
            25,
            392
          ]
        ],
        "stable": true
      },
      "gpt-oss-rs-scalar": {
        "matches_official": true,
        "sequences": [
          [
            200005,
            35644,
            200008,
            976,
            1825,
            5003,
            25,
            392
          ]
        ],
        "stable": true
      },
      "llama.cpp-normal": {
        "matches_official": true,
        "sequences": [
          [
            200005,
            35644,
            200008,
            976,
            1825,
            5003,
            25,
            392
          ]
        ],
        "stable": true
      },
      "llama.cpp-ubatch-1": {
        "matches_official": true,
        "sequences": [
          [
            200005,
            35644,
            200008,
            976,
            1825,
            5003,
            25,
            392
          ]
        ],
        "stable": true
      }
    }
  },
  "content_sha256": "a5fc04807931770e1910ab015e73f8df5f22850e76b0376ee26a41670a3e8487",
  "host": {
    "captured_unix_seconds": 1787015985,
    "cpu": {
      "cpu_family": "6",
      "logical_cpus": "16",
      "microcode": "0x5003901",
      "model": "85",
      "model_name": "Intel(R) Xeon(R) Silver 4215R CPU @ 3.20GHz",
      "stepping": "7",
      "vendor_id": "GenuineIntel"
    },
    "governors": [
      "schedutil"
    ],
    "kernel_release": "7.0.0-29-generic",
    "machine": "x86_64",
    "operating_system": "Linux",
    "selected_physical_cpus": [
      0,
      1,
      2,
      3,
      4,
      5,
      6,
      7
    ]
  },
  "matrix": {
    "analysis_artifact": "mxfp4-analysis.json",
    "bootstrap_iterations": 10000,
    "promotion_status": "positive",
    "raw_artifacts": [
      "mxfp4-gate-up.json",
      "mxfp4-down.json"
    ]
  },
  "model": {
    "gguf_sha256": "aab205256a9b6361e410c24de3086e30f907092ca6f9ba8cd4b22c8a2b025778",
    "historical_gguf_sha256": "27cd6c432c7672cb812a92f611cf3ba7bbc35928262bb1e1253ff4ee6ae35901",
    "id": "openai/gpt-oss-20b",
    "matches_historical_gguf": false,
    "revision": "6cee5e81ee83917806bbde320786a8fb61efebee",
    "source_hashes": {
      "config.json": "3a2a26ded679375b7928ddeca59764df7cea83220c1961035f6d6e232659e9ce",
      "model.safetensors.index.json": "0e085b977c4c9942f85938828e8c989ed7d5cdabf852e4da6a67c116cd502cd1",
      "tokenizer.json": "0614fe83cadab421296e664e1f48f4261fa8fef6e03e63bb75c20f38e37d07d3"
    }
  },
  "prompt": {
    "expected_output_token_ids": [
      200005,
      35644,
      200008,
      976,
      1825,
      5003,
      25,
      392
    ],
    "scenario": "harmony_63",
    "token_ids": [
      200006,
      17360,
      200008,
      3575,
      553,
      17554,
      162016,
      11,
      261,
      4410,
      6439,
      2359,
      22203,
      656,
      7788,
      17527,
      558,
      87447,
      100594,
      25,
      220,
      1323,
      19,
      12,
      3218,
      279,
      30377,
      289,
      25,
      14093,
      279,
      2,
      13888,
      18403,
      25,
      8450,
      11,
      49159,
      11,
      1721,
      13,
      21030,
      2804,
      413,
      7360,
      395,
      1753,
      3176,
      13,
      200007,
      200006,
      1428,
      200008,
      25968,
      483,
      9707,
      1001,
      4022,
      64790,
      13,
      200007,
      200006,
      173781
    ],
    "token_ids_sha256": "ff9e5194630553a210511cf07197796dc07f8756b095b042580282261820cab3"
  },
  "protocol": {
    "cpus": "0-7",
    "fresh_processes": true,
    "gpu_backends": "disabled",
    "greedy_output_tokens": 8,
    "measured_trials_per_lane": 5,
    "page_cache": "warm; no privileged cache dropping",
    "prompt_cache_reuse": false,
    "prompt_tokens": 63,
    "reject_thermal_throttling": true,
    "run_order": [
      {
        "lane": "gpt-oss-rs-auto",
        "order": 0,
        "phase": "warmup",
        "round": 0
      },
      {
        "lane": "gpt-oss-rs-scalar",
        "order": 1,
        "phase": "warmup",
        "round": 0
      },
      {
        "lane": "llama.cpp-normal",
        "order": 2,
        "phase": "warmup",
        "round": 0
      },
      {
        "lane": "llama.cpp-ubatch-1",
        "order": 3,
        "phase": "warmup",
        "round": 0
      },
      {
        "lane": "gpt-oss-rs-scalar",
        "order": 0,
        "phase": "measured",
        "round": 1
      },
      {
        "lane": "llama.cpp-normal",
        "order": 1,
        "phase": "measured",
        "round": 1
      },
      {
        "lane": "llama.cpp-ubatch-1",
        "order": 2,
        "phase": "measured",
        "round": 1
      },
      {
        "lane": "gpt-oss-rs-auto",
        "order": 3,
        "phase": "measured",
        "round": 1
      },
      {
        "lane": "llama.cpp-normal",
        "order": 0,
        "phase": "measured",
        "round": 2
      },
      {
        "lane": "llama.cpp-ubatch-1",
        "order": 1,
        "phase": "measured",
        "round": 2
      },
      {
        "lane": "gpt-oss-rs-auto",
        "order": 2,
        "phase": "measured",
        "round": 2
      },
      {
        "lane": "gpt-oss-rs-scalar",
        "order": 3,
        "phase": "measured",
        "round": 2
      },
      {
        "lane": "llama.cpp-ubatch-1",
        "order": 0,
        "phase": "measured",
        "round": 3
      },
      {
        "lane": "gpt-oss-rs-auto",
        "order": 1,
        "phase": "measured",
        "round": 3
      },
      {
        "lane": "gpt-oss-rs-scalar",
        "order": 2,
        "phase": "measured",
        "round": 3
      },
      {
        "lane": "llama.cpp-normal",
        "order": 3,
        "phase": "measured",
        "round": 3
      },
      {
        "lane": "gpt-oss-rs-auto",
        "order": 0,
        "phase": "measured",
        "round": 4
      },
      {
        "lane": "gpt-oss-rs-scalar",
        "order": 1,
        "phase": "measured",
        "round": 4
      },
      {
        "lane": "llama.cpp-normal",
        "order": 2,
        "phase": "measured",
        "round": 4
      },
      {
        "lane": "llama.cpp-ubatch-1",
        "order": 3,
        "phase": "measured",
        "round": 4
      },
      {
        "lane": "gpt-oss-rs-scalar",
        "order": 0,
        "phase": "measured",
        "round": 5
      },
      {
        "lane": "llama.cpp-normal",
        "order": 1,
        "phase": "measured",
        "round": 5
      },
      {
        "lane": "llama.cpp-ubatch-1",
        "order": 2,
        "phase": "measured",
        "round": 5
      },
      {
        "lane": "gpt-oss-rs-auto",
        "order": 3,
        "phase": "measured",
        "round": 5
      }
    ],
    "scenario": "harmony_63",
    "thermal_end_ceiling_c": 95.0,
    "thermal_start_gate_c": 65.0,
    "threads": 8,
    "warmups_per_lane": 1
  },
  "runs": [
    {
      "decode_tokens_per_second": 1.901319501909018,
      "effective_cpu_kernel": "avx512-vnni",